{"schema_name":"production-promotion-journal","schema_version":"1.0.0","kernel_version":"2.0.0","intent_id":"11111111111111111111111111111111","task_id":"22222222222222222222222222222222","attempt_id":"333333333333333333333333","state":"prepared","entries":[{"source_sha256":"aaaaaaaaaaaaaaaaaaaaaaaaaaaaaaaaaaaaaaaaaaaaaaaaaaaaaaaaaaaaaaaa","staged_path":"待删除/production-promotions/intent/new/0000","target_path":"figures/figure_01.png"}]}
